<!ELEMENT barre_menu (menu*)>
<!ELEMENT menu (article*)>
      <!ATTLIST menu
      	nom_menu CDATA #REQUIRED
      	>
<!ELEMENT article (nom, element*)>
<!ELEMENT nom (#PCDATA)>
<!ELEMENT element (#PCDATA)>
      <!ATTLIST element
      	balise CDATA #REQUIRED
      	>