<?xml version="1.0" encoding="utf-8"?>
<!DOCTYPE barre_menu SYSTEM "../donnes/dtd/articles.dtd">
<barre_menu>
  <menu/>
  <menu nom_menu="La vie à l'école">
    <article>
      <nom>Présentation des classes</nom>
    </article>
    <article>
      <nom>Programme des classes</nom>
    </article>
    <article>
      <nom>Emploi du temps</nom>
    </article>
    <article>
      <nom>Présentation d'activités</nom>
    </article>
    <article>
      <nom>Matériel à disposition</nom>
    </article>
  </menu>
  <menu nom_menu="Etablissement">
    <article>
      <nom>Description</nom>
    </article>
    <article>
      <nom>Horaires</nom>
    </article>
    <article>
      <nom>Le menu de la cantine</nom>
    </article>
    <article>
      <nom>Classe passerelle</nom>
    </article>
    <article>
      <nom>Conseils d'école</nom>
      <element balise="Lien">../donnees/pdf/conseil.pdf</element>
    </article>
  </menu>
  <menu nom_menu="Inscription">
    <article>
      <nom>Conditions d'inscription</nom>
    </article>
    <article>
      <nom>Réglement intérieur</nom>
    </article>
  </menu>
</barre_menu>
