<?xml version="1.0" encoding="utf-8"?>
<!DOCTYPE barre_menu SYSTEM "../donnes/dtd/articles.dtd">
<barre_menu>
  <menu nom_menu="0">
    <article>
      <nom></nom>
    </article>
    <article>
      <nom></nom>
    </article>
  </menu>
  <menu nom_menu="1">
    <article>
      <nom>Présentation de l'école</nom>
    </article>
    <article>
      <nom></nom>
    </article>
  </menu>
  <menu nom_menu="2">
    <article>
      <nom>Horaires et emplois du temps</nom>
      <element balise="Paragraphe">Article en cours de rédaction</element>
    </article>
    <article>
      <nom></nom>
    </article>
  </menu>
  <menu nom_menu="3">
    <article>
      <nom>Inscriptions</nom>
      <element balise="Paragraphe">Article en cours de rédaction</element>
    </article>
    <article>
      <nom></nom>
    </article>
  </menu>
  <menu nom_menu="4">
    <article>
      <nom>Conseils d'école</nom>
    </article>
    <article>
      <nom></nom>
    </article>
  </menu>
  <menu nom_menu="5">
    <article>
      <nom>Contact</nom>
      <element balise="Lien">http://www.google.com</element>
    </article>
    <article>
      <nom></nom>
    </article>
  </menu>
</barre_menu>
