<?xml version="1.0" encoding="utf-8"?>
<!DOCTYPE barre_menu SYSTEM "../donnes/dtd/articles.dtd">
<barre_menu>
  <menu nom_menu="Accueilgg">
    <article>
      <nom>Accueilgg</nom>
    </article>
  </menu>
  <menu nom_menu="Horaires et emplois du temps">
    <article>
      <nom>Horaires et emplois du temps</nom>
      <element balise="Paragraphe">Article en cours de rédaction</element>
    </article>
  </menu>
  <menu nom_menu="Inscriptions">
    <article>
      <nom>Inscriptions</nom>
      <element balise="Paragraphe">Article en cours de rédaction</element>
    </article>
  </menu>
  <menu nom_menu="Contact">
    <article>
      <nom>Contact</nom>
      <element balise="Paragraphe">Article en cours de rédaction</element>
    </article>
  </menu>
</barre_menu>
