<?xml version="1.0" encoding="utf-8"?>
<!DOCTYPE barre_menu SYSTEM "../donnes/dtd/articles.dtd">
<barre_menu>
  <menu nom_menu="Inscriptions">
    <article>
      <nom>Inscriptions</nom>
      <element balise="Paragraphe">Article en cours de r√©daction</element>
    </article>
  </menu>
  <menu nom_menu="Contact">
    <article>
      <nom>Contact</nom>
      <element balise="Lien">http://www.google.com</element>
    </article>
  </menu>
</barre_menu>
